{
  "runId": "run-20260428-001",
  "contractId": "2026-04-28-v110-execution-layer",
  "phase": "implementation",
  "agentType": "generator",
  "timestamp": 1745821200000,
  "content": {
    "changes": [
      {
        "file": "sessions/execution/README.md",
        "type": "created",
        "description": "Execution 目录说明文档",
        "linesAdded": 45,
        "linesRemoved": 0
      },
      {
        "file": "sessions/execution/runs/schemas/plan.json",
        "type": "created",
        "description": "Run Plan 阶段 JSON Schema",
        "linesAdded": 62,
        "linesRemoved": 0
      },
      {
        "file": "sessions/execution/runs/schemas/implementation.json",
        "type": "created",
        "description": "Run Implementation 阶段 JSON Schema",
        "linesAdded": 58,
        "linesRemoved": 0
      },
      {
        "file": "sessions/execution/runs/schemas/review.json",
        "type": "created",
        "description": "Run Review 阶段 JSON Schema",
        "linesAdded": 65,
        "linesRemoved": 0
      },
      {
        "file": "sessions/execution/repairs/schemas/original-review.json",
        "type": "created",
        "description": "Repair 原始评审 JSON Schema",
        "linesAdded": 52,
        "linesRemoved": 0
      },
      {
        "file": "sessions/execution/repairs/schemas/fix-plan.json",
        "type": "created",
        "description": "Repair 修复计划 JSON Schema",
        "linesAdded": 38,
        "linesRemoved": 0
      },
      {
        "file": "sessions/execution/repairs/schemas/verification.json",
        "type": "created",
        "description": "Repair 验证结果 JSON Schema",
        "linesAdded": 40,
        "linesRemoved": 0
      },
      {
        "file": "sessions/execution/repairs/schemas/retry-result.json",
        "type": "created",
        "description": "Repair 重试结果 JSON Schema",
        "linesAdded": 42,
        "linesRemoved": 0
      },
      {
        "file": "sessions/execution/checkpoints/schemas/checkpoint.json",
        "type": "created",
        "description": "Checkpoint JSON Schema",
        "linesAdded": 48,
        "linesRemoved": 0
      },
      {
        "file": "sessions/active-tasks.md",
        "type": "modified",
        "description": "增加 v1.1.0 任务列表和 Execution 关联规范",
        "linesAdded": 35,
        "linesRemoved": 12
      },
      {
        "file": "CLAUDE.md",
        "type": "modified",
        "description": "增加 Execution 记录规则（Phase 3）",
        "linesAdded": 45,
        "linesRemoved": 2
      }
    ],
    "testResults": {
      "passed": 0,
      "failed": 0,
      "coverage": 0,
      "command": "N/A — 纯文档和 Schema 定义，无代码测试"
    },
    "buildResult": {
      "success": true,
      "errors": [],
      "warnings": []
    }
  },
  "extractedForMemory": false
}
